{"generated_at":"2026-07-30T18:52:16+00:00","common_window_first_year":"2017","systems":[{"system_id":"mtl-bixi","trips":88197834,"first_trip":"2014-04-15","last_trip":"2026-06-30","station_identities_seen":1723,"flagged":53332353,"city":"Montreal","system":"BIXI","active_stations":1157,"stations_note":"Distinct station identities, not physical stations. Montreal's three era key spaces are bridged to GBFS where they match; the identities that do not still count separately."},{"system_id":"tor-bikeshare","trips":38577903,"first_trip":"2016-06-30","last_trip":"2026-03-31","station_identities_seen":1245,"flagged":1788164,"city":"Toronto","system":"Bike Share Toronto","active_stations":1069,"stations_note":"Distinct station identities, not physical stations. Montreal's three era key spaces are bridged to GBFS where they match; the identities that do not still count separately."},{"system_id":"van-mobi","trips":8822566,"first_trip":"2017-01-01","last_trip":"2026-07-01","station_identities_seen":328,"flagged":820101,"city":"Vancouver","system":"Mobi by Rogers","active_stations":268,"stations_note":"Distinct station identities, not physical stations. Montreal's three era key spaces are bridged to GBFS where they match; the identities that do not still count separately."}],"window_note":"Each system covers the range shown. Cross-city comparisons are restricted to the common window."}
